{
  "$comment": "Code generated by tools/ci generate. DO NOT EDIT.\nSource: tools/schemagen (the Go type github.com/brunovenceslau/romeu-e-julieta/internal/render.Record)\n\nGenerated by this command:\n\n\tgo generate ./...\n",
  "$schema": "https://json-schema.org/draft/2020-12/schema",
  "additionalProperties": false,
  "properties": {
    "catalogDigest": {
      "type": "string"
    },
    "egress": {
      "additionalProperties": false,
      "properties": {
        "auto": {
          "items": {
            "type": "string"
          },
          "type": "array"
        },
        "effectiveDigest": {
          "type": "string"
        },
        "gated": {
          "items": {
            "additionalProperties": false,
            "properties": {
              "domain": {
                "type": "string"
              },
              "reason": {
                "type": "string"
              }
            },
            "required": [
              "domain",
              "reason"
            ],
            "type": "object"
          },
          "type": "array"
        }
      },
      "required": [
        "auto",
        "effectiveDigest",
        "gated"
      ],
      "type": "object"
    },
    "files": {
      "additionalProperties": {
        "type": "string"
      },
      "type": "object"
    },
    "promoting": {
      "additionalProperties": false,
      "properties": {
        "candidateId": {
          "type": "string"
        },
        "filesDigest": {
          "type": "string"
        },
        "previousFiles": {
          "additionalProperties": {
            "type": "string"
          },
          "type": "object"
        }
      },
      "required": [
        "candidateId",
        "filesDigest",
        "previousFiles"
      ],
      "type": "object"
    },
    "recreateDigest": {
      "type": "string"
    },
    "repos": {
      "items": {
        "additionalProperties": false,
        "properties": {
          "dir": {
            "type": "string"
          },
          "egressCommit": {
            "type": "string"
          },
          "egressRef": {
            "type": "string"
          },
          "lockSha256": {
            "type": "string"
          },
          "url": {
            "type": "string"
          }
        },
        "required": [
          "dir",
          "egressCommit",
          "egressRef",
          "url"
        ],
        "type": "object"
      },
      "type": "array"
    },
    "romeuVersion": {
      "type": "string"
    },
    "schema": {
      "const": "render/v1",
      "type": "string"
    },
    "specSource": {
      "additionalProperties": false,
      "properties": {
        "commit": {
          "type": "string"
        },
        "kind": {
          "type": "string"
        },
        "ref": {
          "type": "string"
        }
      },
      "required": [
        "commit",
        "kind",
        "ref"
      ],
      "type": "object"
    },
    "wideningDigest": {
      "type": "string"
    }
  },
  "required": [
    "catalogDigest",
    "egress",
    "files",
    "recreateDigest",
    "repos",
    "romeuVersion",
    "schema",
    "specSource",
    "wideningDigest"
  ],
  "title": "render.v1",
  "type": "object"
}
