{
  "schema": "render/v1",
  "romeuVersion": "v1.0.0",
  "specSource": {
    "kind": "origin",
    "ref": "refs/romeu/origin/my-config/main",
    "commit": "cccccccccccccccccccccccccccccccccccccccc"
  },
  "repos": [
    {
      "dir": "shop-api",
      "url": "https://github.com/example/shop-api",
      "egressRef": "refs/romeu/origin/shop-api/main",
      "egressCommit": "aaaaaaaaaaaaaaaaaaaaaaaaaaaaaaaaaaaaaaaa",
      "lockSha256": "eeeeeeeeeeeeeeeeeeeeeeeeeeeeeeeeeeeeeeeeeeeeeeeeeeeeeeeeeeeeeeee"
    },
    {
      "dir": "shop-web",
      "url": "https://github.com/example/shop-web",
      "egressRef": "refs/romeu/origin/shop-web/main",
      "egressCommit": "bbbbbbbbbbbbbbbbbbbbbbbbbbbbbbbbbbbbbbbb"
    }
  ],
  "files": {
    ".romeu/bin/SHA256SUMS": "3333333333333333333333333333333333333333333333333333333333333333",
    ".romeu/bin/julieta-linux-arm64": "2222222222222222222222222222222222222222222222222222222222222222",
    ".romeu/kits/julieta-111111111111": "1111111111111111111111111111111111111111111111111111111111111111",
    ".romeu/kits/julieta-claude-222222222222": "2222222222222222222222222222222222222222222222222222222222222222",
    ".romeu/kits/my-home-555555555555": "5555555555555555555555555555555555555555555555555555555555555555",
    "sbxenv.yaml": "1111111111111111111111111111111111111111111111111111111111111111"
  },
  "egress": {
    "auto": [
      "dl.google.com",
      "nodejs.org"
    ],
    "gated": [
      {
        "domain": "github.com",
        "reason": "upload"
      }
    ],
    "effectiveDigest": "4c2032649729a90791b4906c436d4cf840b620cfad57bd135da20ed10ce89fd9"
  },
  "wideningDigest": "dddddddddddddddddddddddddddddddddddddddddddddddddddddddddddddddd",
  "recreateDigest": "ffffffffffffffffffffffffffffffffffffffffffffffffffffffffffffffff",
  "catalogDigest": "9999999999999999999999999999999999999999999999999999999999999999"
}
